{
  "schema_version": "2.0",
  "project_id": "RUNNER-SELFTEST",
  "component_id": "WORDPRESS-PHASE3",
  "run_id": "RUNNER-SELFTEST-20260827-001",
  "phase": "PHASE3",
  "source": {
    "mode": "none"
  },
  "environment": {
    "wordpress": "7.0.2",
    "php": "8.4",
    "mariadb": "11.8.8"
  },
  "tests": [
    "environment"
  ]
}

